# SMART evidence — drive S5Y4R020A077808
# Captured: 2026-10-01T20:30:25+02:00 on nas-aku (drive on motherboard AHCI SATA port, AMD B550)
# Command: smartctl -x /dev/sdc

smartctl 7.5 2025-04-30 r5714 [x86_64-linux-6.12.93] (local build)
Copyright (C) 2002-25, Bruce Allen, Christian Franke, www.smartmontools.org

=== START OF INFORMATION SECTION ===
Model Family:     Samsung based SSDs
Device Model:     Samsung SSD 870 EVO 2TB
Serial Number:    S5Y4R020A077808
Firmware Version: W0814A0
User Capacity:    2,000,398,934,016 bytes [2.00 TB]
Sector Size:      512 bytes logical/physical
Rotation Rate:    Solid State Device
Form Factor:      2.5 inches
TRIM Command:     Available
Device is:        In smartctl database 7.5/5706
ATA Version is:   ACS-2 T13/2015-D revision 3
SATA Version is:  SATA 3.2, 6.0 Gb/s (current: 6.0 Gb/s)
Local Time is:    Thu Oct  1 20:30:25 2026 CEST
SMART support is: Available - device has SMART capability.
SMART support is: Enabled
AAM feature is:   Unavailable
APM level is:     254 (maximum performance)
Rd look-ahead is: Enabled
Write cache is:   Enabled
DSN feature is:   Unavailable
ATA Security is:  Disabled, NOT FROZEN [SEC1]

=== START OF READ SMART DATA SECTION ===
SMART overall-health self-assessment test result: PASSED

General SMART Values:
Offline data collection status:  (0x00)	Offline data collection activity
					was never started.
					Auto Offline Data Collection: Disabled.
Self-test execution status:      (   0)	The previous self-test routine completed
					without error or no self-test has ever 
					been run.
Total time to complete Offline 
data collection: 		(  120) seconds.
Offline data collection
capabilities: 			 (0x11) SMART execute Offline immediate.
					No Auto Offline data collection support.
					Suspend Offline collection upon new
					command.
					No Offline surface scan supported.
					Self-test supported.
					No Conveyance Self-test supported.
					No Selective Self-test supported.
SMART capabilities:            (0x0002)	Does not save SMART data before
					entering power-saving mode.
					Supports SMART auto save timer.
Error logging capability:        (0x01)	Error logging supported.
					General Purpose Logging supported.
Short self-test routine 
recommended polling time: 	 (   2) minutes.
Extended self-test routine
recommended polling time: 	 (  10) minutes.
SCT capabilities: 	       (0x0001)	SCT Status supported.

SMART Attributes Data Structure revision number: 1
Vendor Specific SMART Attributes with Thresholds:
ID# ATTRIBUTE_NAME          FLAGS    VALUE WORST THRESH FAIL RAW_VALUE
  1 Raw_Read_Error_Rate     -O--CK   100   100   050    -    0
  5 Reallocated_Sector_Ct   -O--CK   100   100   050    -    4
  9 Power_On_Hours          -O--CK   100   100   050    -    10006
 12 Power_Cycle_Count       -O--CK   100   100   050    -    283
160 Unknown_Attribute       -O--CK   100   100   050    -    1
161 Unknown_Attribute       PO--CK   100   100   050    -    73
163 Unknown_Attribute       -O--CK   100   100   050    -    7
164 Unknown_Attribute       -O--CK   100   100   050    -    7280
165 Unknown_Attribute       -O--CK   100   100   050    -    47
166 Unknown_Attribute       -O--CK   100   100   050    -    6
167 Unknown_Attribute       -O--CK   100   100   050    -    31
168 Unknown_Attribute       -O--CK   100   100   050    -    3808
169 Unknown_Attribute       -O--CK   100   100   050    -    100
175 Program_Fail_Count_Chip -O--CK   100   100   050    -    0
176 Erase_Fail_Count_Chip   -O--CK   100   100   050    -    0
177 Wear_Leveling_Count     -O--CK   100   100   050    -    0
178 Used_Rsvd_Blk_Cnt_Chip  -O--CK   100   100   050    -    4
181 Program_Fail_Cnt_Total  -O--CK   100   100   050    -    0
182 Erase_Fail_Count_Total  -O--CK   100   100   050    -    0
192 Power-Off_Retract_Count -O--CK   100   100   050    -    281
194 Temperature_Celsius     -O---K   100   100   050    -    40
195 ECC_Error_Rate          -O--CK   100   100   050    -    0
196 Reallocated_Event_Count -O--CK   100   100   050    -    1
197 Current_Pending_Sector  -O--CK   100   100   050    -    4
198 Offline_Uncorrectable   -O--CK   100   100   050    -    1
199 CRC_Error_Count         -O--CK   100   100   050    -    0
232 Available_Reservd_Space -O--CK   100   100   050    -    73
241 Total_LBAs_Written      ----CK   100   100   050    -    411152
242 Total_LBAs_Read         ----CK   100   100   050    -    457876
245 Timed_Workld_Media_Wear -O--CK   100   100   050    -    1233152
                            ||||||_ K auto-keep
                            |||||__ C event count
                            ||||___ R error rate
                            |||____ S speed/performance
                            ||_____ O updated online
                            |______ P prefailure warning

General Purpose Log Directory Version 1
SMART           Log Directory Version 1 [multi-sector log support]
Address    Access  R/W   Size  Description
0x00       GPL,SL  R/O      1  Log Directory
0x01           SL  R/O      1  Summary SMART error log
0x02           SL  R/O      1  Comprehensive SMART error log
0x03       GPL     R/O      1  Ext. Comprehensive SMART error log
0x04       GPL,SL  R/O      8  Device Statistics log
0x06           SL  R/O      1  SMART self-test log
0x07       GPL     R/O      1  Extended self-test log
0x10       GPL     R/O      1  NCQ Command Error log
0x11       GPL     R/O      1  SATA Phy Event Counters log
0x24       GPL     R/O     88  Current Device Internal Status Data log
0x25       GPL     R/O     32  Saved Device Internal Status Data log
0x30       GPL,SL  R/O      9  IDENTIFY DEVICE data log
0x80-0x9f  GPL,SL  R/W     16  Host vendor specific log

SMART Extended Comprehensive Error Log Version: 1 (1 sectors)
No Errors Logged

SMART Extended Self-test Log Version: 1 (1 sectors)
Num  Test_Description    Status                  Remaining  LifeTime(hours)  LBA_of_first_error
# 1  Short offline       Completed without error       00%      8141         -
# 2  Short offline       Completed without error       00%      8057         -
# 3  Short offline       Interrupted (host reset)      90%      7972         -
# 4  Extended offline    Interrupted (host reset)      90%      7899         -
# 5  Short offline       Completed without error       00%      7886         -
# 6  Short offline       Completed without error       00%      7815         -
# 7  Short offline       Completed without error       00%      7728         -
# 8  Short offline       Completed without error       00%      7614         -
# 9  Extended offline    Completed without error       00%      7469         -
#10  Short offline       Completed without error       00%      7446         -
#11  Extended offline    Completed without error       00%      7257         -
#12  Extended offline    Completed without error       00%      7089         -
#13  Extended offline    Completed without error       00%      6921         -
#14  Extended offline    Interrupted (host reset)      90%      6752         -
#15  Extended offline    Completed without error       00%      6584         -
#16  Extended offline    Completed without error       00%      6415         -
#17  Extended offline    Completed without error       00%      6247         -
#18  Extended offline    Completed without error       00%      6079         -
#19  Extended offline    Completed without error       00%      5910         -

Selective Self-tests/Logging not supported

SCT Status Version:                  3
SCT Version (vendor specific):       0 (0x0000)
Device State:                        Active (0)
Current Temperature:                    40 Celsius
Power Cycle Min/Max Temperature:     40/40 Celsius
Lifetime    Min/Max Temperature:     23/40 Celsius
Specified Max Operating Temperature:   100 Celsius
Under/Over Temperature Limit Count:   0/0

SCT Data Table command not supported

SCT Error Recovery Control command not supported

Device Statistics (GP Log 0x04)
Page  Offset Size        Value Flags Description
0x01  =====  =               =  ===  == General Statistics (rev 1) ==
0x01  0x008  4             283  ---  Lifetime Power-On Resets
0x01  0x010  4           10006  ---  Power-on Hours
0x01  0x018  6      1175504312  ---  Logical Sectors Written
0x01  0x020  6       611707976  ---  Number of Write Commands
0x01  0x028  6      4237592463  ---  Logical Sectors Read
0x01  0x030  6       156990242  ---  Number of Read Commands
0x07  =====  =               =  ===  == Solid State Device Statistics (rev 1) ==
0x07  0x008  1               1  ---  Percentage Used Endurance Indicator
                                |||_ C monitored condition met
                                ||__ D supports DSN
                                |___ N normalized value

Pending Defects log (GP Log 0x0c) not supported

SATA Phy Event Counters (GP Log 0x11)
ID      Size     Value  Description
0x0001  4            0  Command failed due to ICRC error
0x0002  4            0  R_ERR response for data FIS
0x0005  4            0  R_ERR response for non-data FIS
0x000a  4            0  Device-to-host register FISes sent due to a COMRESET

